,Frutas,Precio Frutas,Verdura,Precio Verduras,Lacteos,Precio Lacteos,Carne,Precio Carnes,Enlatados ,Precio Enlatados
0,Platano 1 Kg,16.95,Tomate Huaje Supremo 1 Kg,31.0,Caperucita Queso Manchego En Cubos 250 G 250 Gr,73.0,Molida Pulpa Negra De Res 500 Gr,109.0,Atun En Agua 140 Gr,18.9
1,Papaya Maradol 1 Kg,33.9,Aguacate Supremo 1 Kg,51.0,Caperucita Queso Manchego Reducido Grasa 400 G 400 Gr,122.0,Molida London Broil De Res 500 Gr,119.0,Frijoles Refritos Bayos 400 Gr,16.9
2,Sandia Sangria 1 Kg,13.0,Papa Blanca 1 Kg,31.0,Zwan Queso Manchego Rallado 250 G 250 Gr,62.0,Molida Pulpa Fina De Res 300 Gr,59.9,Elote En Lata 220 Gr,10.0
3,Melon Chino 1 Kg,26.0,Cebolla Bca Limpia 1 Kg,38.0,Zwan Queso Manchego Rebanado 400 G 400 Gr,97.0,Molida Sirloin De Res 300 Gr,61.9,Elote En Lata 432 Gr,14.9
4,Naranja Valencia 1 Kg,17.5,Limon Agrio Supremo 1 Kg,39.0,Queso Crema 200 Gr,32.9,Pechuga De Pollo S/H 1 Kg,144.0,Atun En Agua 140 Gr,19.5
5,Fresa 1 Lb 454 Gr,83.0,Nopal Limpio 1 Kg,29.95,Leche Uht Entera 1 Lt,22.9,Milanesa Natural De Pollo Paq.De.550Gr 550 Gr,86.9,Frijoles Refritos Peruanos 400 Gr,16.9
6,Jicama Gde 1 Kg,16.95,Cilantro Manojo,6.95,Leche Almendras Original 1.89 Lt,61.9,Milanesa De Pulpa Negra 1 Kg,219.0,Atun En Agua Solido De Lomo 140 Gr,31.0
7,Pina Miel Gold,57.0,Zanahoria 1 Kg,13.95,Queso Panela 400 Gr,75.9,Pechuga De Pollo Deshuesada 1 Kg,138.9,Atun En Agua 140 Gr,10.9
8,Manzana Golden Saltillo Bin 1 Kg,36.0,Pepino Fresco 1 Kg,19.95,Huevo Blanco 30 Pz,62.0,Muslo De Pollo Paq.Reg. 1 Kg,68.9,Frijoles Pintos 425 Gr,18.9
9,Sandia Roja Sin Semilla 1 Kg,12.95,Calabacita 1 Kg,20.5,Leche Evaporada Regular 360 Gr,16.9,Pierna Con Muslo De Pollo Corte Americano Fres 1 Kg,25.9,Atun Jumbo En Agua 295 Gr,39.0
10,Manzana Gala Imp 1 Kg,59.95,Elote Blanco,5.95,Leche Condensada 387 Gr 397 Gr,24.0,Alco Milanesa Corazon 170 Gr. 170 Gr,29.9,Atun En Agua Pouch 75 Gr,18.5
11,Manzana Golden En Bsa Nacional1.34 1.36 Gr,39.9,Espinaca Manojo,8.95,Fermentados Natural 400 Gr,30.9,Molida Clásica De Res 1 Kg,149.0,Elote En Lata 225 Gr,8.5
12,Pera D Anjou 1 Kg,67.5,Lechuga Romana,15.95,Leche Uht Deslactosada Light 1Lt 1 Lt,23.5,Fajita De Pollo 1 Kg,144.0,Frijoles Refritos Bayos 400 Gr,12.5
13,Manzana Golden Nacional 1 Kg,34.95,Limon S/Semilla 1 Kg,29.95,Leche Uht Deslactosada Light 1 Lt,24.0,Pierna Y Muslo De Pollo Iqf 1 Kg,25.9,Elote En Lata 220 Gr,10.0
14,Uva Blanca S/S Suprema 1 Kg,104.0,Tomate Bola Supremo 1 Kg,41.0,Leche Uht Deslactosada Light 1 Lt,24.0,Pechuga De Pollo C/H S/Piel Empacada 1 Kg,140.9,Sopa Fideo 95 Gr,13.0
15,Manzana Red Delicious Imp Suprema 1 Kg,46.95,Brocoli Coronas 1 Kg,36.0,Mantequilla Barra Sin Sal 90 Gr,19.5,Pechuga Entera C/H De Pollo Bolsa 1 Kg,109.0,Atun Pouch Agua 74 Gr,20.9
16,Manzana Golden Imp Suprema 218 Gr,73.0,Lechuga Orejona,16.95,Mantequilla Barra Con Sal 90 Gr,19.5,Aguja Norteña C/H De Res 1 Kg,209.0,Atun En Aceite 140 Gr,19.5
17,Toronja Sangria 1 Kg,22.0,Chayote Sin Espinas 1 Kg,28.0,Leche Uht 100 Proteina Reducida Grasa 1 Lt,27.5,Filete De Mojarra Natural 1 Kg,149.0,Frijoles Refritos Negros 400 Gr,16.9
18,Blue Berries 170 Gr,54.95,Coliflor Blanca Pza,34.95,Huevo Blanco Mediano 30 Pz,58.9,Molida De Res 95/5 400 Gr,70.9,Atun En Agua Pouch 74 Gr,15.9
19,Platano Macho Gde 1 Kg,26.95,Papa Blanca Chica 1 Kg,24.95,Yogurt Griego Natural 150 Gr,18.9,Chuleta Ahumada Paq. Fam 1 Kg,89.9,Atun Pouch Agua 78 Gr,19.9
20,Guayaba Suprema 1 Kg,29.9,Cebolla Cambray,9.95,Crema Liquida Regular 450 Ml,33.5,Pierna De Cerdo C/H Rebanada 1 Kg,79.9,Atun En Agua 130 Gr,21.0
21,Frambuesa 170 Gr,56.95,Seasons Select Aguacate Malla,36.95,Leche Deslactosada Light 1 Six 6 Lt,130.5,Brisket De Res 1 Kg,199.0,Atun Agua 295 Gr,39.9
22,Kiwi 1 Kg,99.95,Acelga Verde,8.95,Leche Uht Deslactosada 1 Lt,24.0,Muslo S/Rs/Piel Empacado 1 Kg,80.9,Elote En Lata 400 Gr,16.0
23,Sandia Bambino 1 Kg,20.95,Tomatillo Limpio Season Select,17.95,Leche Almendras Sin Endulzar 1.89 Lt,61.9,Milanesa De Pollo Premium 500 Gr,96.9,Frijoles Bayos Refritos 430 Gr,15.5
24,Zarzamora 170 Gr,56.95,Limon Amarillo ( Variedad Eureka) 1 Kg,59.95,Leche Almendras Vainilla Sin Azucar 1.89 Lt,61.9,Costilla Norteña S/H De Res 1 Kg,169.0,Sopa Ramen De Pollo 85 Gr,6.0
25,Uva Roja S/S Suprema 1 Kg,93.5,Tomate Fresadilla 1 Kg,17.95,Uht Producto Lacteo 1Lt 1 Lt,17.5,Heb Fajitas De Pechuga De Pollo Bolsa De 1 Kg,131.0,Elote Blanco En Lata 220 Gr,14.5
26,Manzana Granny Smith Gde Imp 1 Kg,79.95,Champinon Bco Reb De 225,21.95,Fermentados Sin Azucar Pack 400 Gr,34.9,Pechuga C/H De Pollo 1 Kg,109.0,Sopa Fideo 143 Gr,17.0
27,Durazno Importado 1 Kg,99.95,Chile Poblano 1 Kg,44.95,Leche Uht Deslactosada 1.5Lt 1.5 Lt,33.9,Milanesa De Pulpa Blanca 1 Kg,199.0,Sopas Knorr Sopa Estrellitas 143 Gr,17.0
28,Melon Valenciano 1 Kg,29.95,Apio 1 Kg,19.95,Queso Chihuahua Menonita 550 Gr,89.9,Milanesa Marinada D/Pollo Paq.De 550 Gr,86.9,Frijoles Peruanos Refritos 400 Gr,13.0
29,Toronja En Malla De 2.5K 2.5 Kg,44.95,Pimiento Semaforo C/3,44.95,Huevo Blanco Mediano 18 Pz,47.9,Filete Tilapia Granja Grande 1 Kg,149.0,Frijoles Refritos Bayos 580 Gr,13.5
30,Pera Bartlet 1 Kg,69.95,Chile Serrano 1 Kg,41.0,Leche Uht Deslactosada Semidecremada 1Lt 1 Lt,23.5,Pierna Bate S/Piel Empacado 1 Kg,80.9,Sopa Letras 95 Gr,13.0
31,Platano Dominico 1 Kg,44.95,Mini Floretes De Brocoli,19.95,Leche Uht Light 1Lt 1 Lt,22.9,Filete De Mojarra Granja En Bolsa 900 Gr,104.0,Atun Agua Pouch 180 Gr,43.9
32,Blueberrie Clam 510 Gr 170 Gr,125.0,Perejil Liso,12.95,Leche Uht Light 1 Lt,22.9,Molida De Res 90/10 400 Gr,62.9,Garbanzo Al Natural 400 Gr,16.0
33,Piña Miel Suprema,59.95,Cebolla Morada 1 Kg,34.95,Leche Uht Deslactosada Entera 1 Lt,24.0,Molida De Res 80 / 20 400 Gr,50.9,Sopas Knorr Sopa Letras 143 Gr,17.0
34,Manzana Gala Nacional Bolsa 1.36 Kg,42.95,Tomatillo Limpio 1 Kg,21.95,Leche Uht Entera 1Lt 1 Lt,22.9,Milanesa De Pollo Congelada Bolsa 750 Gr,119.0,Chiles Jalapeños Rajas 340 Gr,20.0
35,Kiwi Dorado Clam C/3Pz,69.95,Chile Jalapeño 1 Kg,31.0,Huevo Blanco Mediano 12 Pz,25.9,Carbon Mezquite De 3 Kg,69.0,Chiles Chipotles Adobados 105 Gr,11.9
36,Manzana Gala Nacional En Bsa 600 Gr,24.95,S S Limon Agrio En Malla 1.5 Kg,49.95,Huevo Blanco 18 Pz,38.0,Milanesa De Pechuga Aplanada Charola 1 Kg,160.0,Pimiento Morron En Tiras 200 Gr,16.5
37,Uva Negra S/ Semila 1 Kg,109.0,Esparrago 1Lb 1 Lb,99.95,Yogurt Griego Natural 145 Gr,9.2,Lomos De Salmon Prev. Cong. 1 Kg,379.0,Sopa De Pollo Con Verduras 64 Gr,11.9
38,Ciruela Roja Importada 1 Kg,89.95,Aguacatito En Malla,34.95,Mantequilla Sin Sal 90 Gr,15.9,Cortadillo De Sirloin P/Guisar 1 Kg,189.0,Atun Agua 295 Gr,35.9
39,Fruta Cortada Chico 300 Gr,22.95,Pimiento Verde 1 Kg,64.95,Yogurt Griego Natural 907 Gr,75.9,Top Sirloin 1 Kg,199.0,Sopa De Camaron C/Limon Y Habanero 64 Gr,11.9
40,Manzana Red En Bolsa 1.36 1.3 Kg,59.95,Champinon Bco Entero De 225 Gr,21.95,Queso Rallado Mezcla Mexicana 300 Gr,75.9,Arrachera De Res Marinada 600 Gr,159.0,Sopa Municiones 95 Gr,13.0
41,Fresh Piña Cortada 1 Kg,94.95,Repollo Verde 1 Kg,12.95,Clara De Huevo 1 Kg,40.0,Carne De Res Deshebrada 300 Gr,105.0,Sopa Estrellas 115 Gr,16.0
42,Coco,19.95,Lechuga Morada (Sangria) Nal,12.95,Queso Manchego 550 Gr,89.9,Bistec S/H Para Asar De Res Supreme 1 Kg,169.0,Sopa Ramen Carne De Res 85 Gr,6.0
43,Fresh Jicama Cortada 1 Kg,47.95,Betabel Rebotado 1 Kg,19.95,Huevo Blanco 18 Pz,53.5,Carne De Cerdo Tipo Trompo 500 Gr,59.9,Atun En Aceite 130 Gr,21.0
44,Tuna Roja 1 Kg,18.95,Ajo Seasons Select Ajo 4Pzas,44.95,Leche Uht Desl Baja En Grasa 1.5Lt 1.5 Lt,33.9,Deshebrada De Pulpa Negra 1 Kg,209.0,Garbanzo En Lata 400 Gr,15.5
45,Fresh Sandia Cortada 1 Kg,52.95,Ajo En Malla,44.95,Leche Uht Entera 1.5 Lt,31.9,Molida De Cerdo 1 Kg,74.9,Chiles Jalapeños Rajas 240 Gr,12.5
46,Manzana Crisp Pink 1 Kg,65.5,Lechuga Italiana Nal,14.95,Crema Liquida Regular 250 Ml,18.9,Milanesa De Pulpa Bola 1 Kg,209.0,Elote En Lata 400 Gr,13.0
47,Fresh Melon Cortado 1 Kg,62.95,Floretes Brocoli En Bolsa 1Lb 454 Gr,19.95,Huevo Mediano Mt 30 Pz,61.0,Fajita De Pechuga Natural 500 Gr,79.9,Atun Bajo En Sodio 74 Gr,22.0
48,Fruta Cortada Grande 600 Gr,44.95,Palitos De Apio Heb 400 Gr,29.0,Leche Entera 1 Six 6 Lt,125.9,Milanesa De Sirloin De Res 1 Kg,209.0,Chilorio De Cerdo Pouch 215 Gr,55.0
49,Higo Clam,69.95,Lechuga Hidroponica Francesa,29.95,Huevo Blanco Jumbo Con Vitamina E 30 Pz,69.5,Aguja Norteña C/H De Res 1 Kg,179.0,Macarron Con Queso 206 Gr,11.9
50,Granada Roja 1 Kg,99.95,Ejote Verde 1 Kg,49.95,Media Crema 225 Gr,14.5,Milanesa De Pulpa Negra Junior 1 Kg,239.0,Garbanzo En Lata 425 Gr,13.9
51,Melon Orangeflesh 1 Kg,29.95,Cebolla Amarilla 1 Kg,22.95,Formula Lactea Two Pack 2 Lt,34.0,Picaña De Res Fresca 1 Kg,277.0,Chilorio De Pavo Pouch 215 Gr,51.9
52,Manzana Ambrosia 1 Kg,73.0,Champinon Bco Reb De 225 Gr,22.95,Yogurt Griego Batido Natural Sin Azucar 145 Gr,12.0,Muslos De Pollo Amarillo S/Raba Empacado 1 Kg,76.9,Frijoles Negros Refritos 400 Gr,13.0
53,Mandarina Dancy 1 Kg,20.95,Champinon Cremini Reb De 225 Gr,21.95,Leche Uht Light 1 Lt,16.9,Costilla Norteña S/H De Res 1 Kg,179.0,Garbanzo En Salmuera 440 Gr,18.0
54,Uva Globo Roja 1 Kg,109.0,Tomate Cherubs 283 Gr,39.95,Huevo Blanco Mediano 12 Pz,34.9,Salchicha Ahumada Polaca 396 Gr,59.9,Frijoles Negros 560 Gr,13.6
55,Manzana Braeburn 1 Kg,76.95,Ensalada Lechuga Hidroponica Italiana,29.95,Leche Uht Entera 1Lt 1 Lt,16.9,Vampiros De Pulpa Negra En Trocitos 1 Kg,249.0,Sopa Coditos 95 Gr,13.0
56,Arandano Deshidratado 1 Kg,189.0,Tomate D Glory 283 Gr,39.95,La Villita Queso Americano 210 Gr,32.0,Ensalada De Surimi 250 Gr,44.0,Atun En Aceite 140 Gr,18.9
57,Manzana Honey Crisp 1 Kg,86.0,Vegetalistos Zanahoria Baby 340 Gr,21.95,Chila Queso Molido 450 Gr 450 Pz,45.0,Ensalada De Surimi Tampico 250 Gr,44.0,El Dorado Atun Atun En Agua 285 Gr,24.0
58,Pera Asiatica Golden 1 Kg,72.0,Champinon Cremini De 225 Gr,21.95,Chila Queso Molino 900 Gr 900 Pz,76.0,Harina Sazonado Picante 284 Gr,20.5,Frijoles Molidos 430 Gr,12.9
59,Zarzamora 340 Gr,120.0,Cebolla De Rabo,13.95,Leche De Almendra Sin Azucar 946 Ml,43.0,Harina Sazonada Limon 284 Gr,20.5,Sopa Estrellas 95 Gr,13.0
60,Maracuya 1 Kg,44.95,Rabanitos En Manojo,16.95,Leche De Almendra Chocolate 946 Ml,43.0,Harina Sazonada Para Pescado 284 Gr,20.5,Atun En Agua 295 Gr,44.0
61,Pera Asiatica H 1 Kg,62.95,Papa Galeana 1 Kg,45.95,Sabor Tradicional Leche Pasteurizada Sabor Chocola 3.78 Lt,78.0,Chicharron Estilo Carniceria 250Gr. 250 Gr,71.0,Lomo Atun Gourmet En Agua 140 Gr,31.9
62,Naranja Navel S/Semilla 1 Kg,49.95,Pimiento Rojo 1 Kg,89.95,Sabor Tradicional Leche Pasteurizada Sabor Chocola 1.89 Lt,43.0,Ensalada Sierra Ahumada Al Chipotle 250 Gr,52.0,Elote En Lata 220 Gr,10.0
63,Ciruela Pasa Sin Hueso 1 Kg,179.0,Vegetalistos Jicama Precortada 454 Gr,25.95,Yogurt Fresa Y Siruela Sin Azucar 6 Pz,66.0,Ensalada Sierra Ahumada Natural 250 Gr,52.0,Base P/Pay 170 Gr,34.9
64,Toronja Ruby Red Rosa 1 Kg,22.95,Jengibre 1 Kg,109.0,Yogurt Fresa Y Piña Sin Azucar 6 Pz,66.0,Ensalada Sierra Ahumada Al Jalapeño 250 Gr,52.0,Atun En Aceite Oliva 140 Gr,39.9
65,Uva Pasa 1 Kg,99.95,Mezcla De Floretes Brocoli/Coliflor,23.95,Shot Probioticos Frambuesa 100 Gr,10.0,Salsa Coctelera Familiar,26.0,Champiñones Rebanados En Lata 186 Gr,12.9
66,Manzana Fuji Gde Imp 1 Kg,64.95,Camote Amarillo 1 Kg,46.95,Yogurt Batido Topping Zucaritas 202 Gr,12.0,Salsa Coctelera Picante,26.0,Frijoles Enteros Negros 454 Gr,15.5
67,Mamey Gde 1 Kg,44.95,Calabaza Criolla 1 Kg,46.95,Yogurt Batido Topping Froot Loops 202 Gr,12.0,Chorizo Uruguayo Chorizo Uruguayo 500 Pz,89.5,Chiles Jalapeños Rajas 105 Gr,8.0
68,Platano Manzano Gde 1 Kg,34.95,Vegetalistos Zanahoria Rallada 340 Gr,17.95,Yogurt Batido Topping Chocokrispis 202 Gr,12.0,Hamburguesa De Atun 2 Pack 200 Gr,37.0,Sopa Fideos Con Pollo 95 Gr,13.0
69,Mandarina Fremont 1 Kg,20.95,Corazon De Apio,20.95,Yogurt Griego Zero Frutos Rojos 120 Gr,10.0,Medallon De Atun Rojo Pza 200 Gr,71.0,Sopa Ramen C/ Camaron Habanero 85 Gr,6.0
70,Guanabana Gde 1 Kg,76.95,Germinado De Soya 250 Gr,26.95,Yogurt Griego Zero Frutos Amarillo 120 Gr,10.0,Cabrito Para Asar De 4.2 A 4.5 Kg.,1545.0,Atun En Aceite De Oliva En Pouch 85 Gr,24.9
71,Yaka Yaka 1 Kg,39.95,Papa Blanca Malla 800 Grs,24.95,Yogurt Griego Zero Batido Natural 120 Gr,10.0,Boneless Lemon & Pepper 700 Gr,151.0,Atun En Agua 140 Gr,17.5
72,Melon Canary 1 Kg,29.95,Elote Amarillo En Charola,42.95,Yogurt Kids Bebible Oreo 220 Gr,11.0,Fajitas De Atun 350 Gr,106.0,Atun En Agua Pouch 85 Gr,19.5
73,Membrillo 1 Kg,59.9,Hongo Portabellini De 225 Gr,22.95,Yogurt Almendra Bebible Libre De Lacteos Fresa 220 Gr,16.0,Salmon Ahumado Fileteado 300 Gr,275.0,Frijoles Enteros Claros 454 Gr,15.5
74,Coco Rallado 1 Kg,129.0,Tajin Chile Guajillo 75 Gr,32.95,Yogurt Kids Bebible Fresa 220 Gr,11.0,Arrachera Pollo Norteño 500 Gr,60.0,Sopa De Res Con Verduras 64 Gr,11.9
75,Mandarina Sunburst 1 Kg,19.95,Bits De Coliflor,39.95,Yogurt Almendra Bebible Libre De Lacteos Natural 220 Gr,16.0,Arrachera Pollo Jalapeño 500 Gr,60.0,Sopa Knorr Sopa Municiones Mas Pasta 24X115G 115 Gr,16.0
76,Caña De Azucar 1 Kg,12.95,Chayote Con Espinas 1 Kg,21.95,Yogurt Almendra Batido Libre De Lacteos Natural 145 Gr,17.5,Arrachera De Pollo Adobada 700 Gr,193.0,Ensalada Campesina 400 Gr,12.0
77,Chicozapote 1 Kg,44.95,Berenjena 1 Kg,69.95,Yogurt Almendra Batido Libre De Lacteos Fresa 145 Gr,17.5,Filete Empanizado Picante 700 Gr,152.0,Sopa Ramen De Camaron 85 Gr,6.0
78,Arandano Enchilado 1 Kg,249.0,Champinon Bco Ent De 450 Gr,44.95,Heb Queso Panela Light 1Kg 1 Kg,176.0,Arrachera De Pavo Sabor Finas Hierbas 500 Gr,63.0,Frijoles Bayos Refritos 430 Gr,10.9
79,Ciruela Pasa 1 Kg,169.0,Tomate Cherry Mr Lucky 280 Gr,32.95,Heb Queso Panela Natural 1 Kg,171.0,Filete De Tilapia Quinoa 500 Kg,115.0,Pure De Papa Instantaneo 160 Gr,19.9
80,Tejocote 1 Kg,44.95,Zanahoria Baby Heb 400 Gr,38.95,Heb Queso Panela Deslactosado 1Kg 1 Kg,179.0,Maíz Para Pozole 1 Kg,61.0,Atun Premium En Agua 130 Gr,24.0
81,Glaze P/Pie Fresa 454 Gr,63.95,Zanahoria Mediana En Bolsa 454 Gr,10.95,Heb Queso Fresco 1 Kg,176.0,Heb Fajitas De Pollo Asadas Cocidas 737.08 Gr,147.0,Ensalada Atun Light 135 Gr,17.9
82,Glaze De Fresa Pouch Bolsa 454 Gr,51.95,Betabel Manojo,19.95,Clara De Huevo Liquida 500 G 500 Gr,23.0,Nuggets De Pollo Preformado 907.18 Gr,103.0,Zanahorias En Escabeche 230 Gr,9.9
83,Persimonio 1 Kg,89.9,Champino Bco Entero 225Gr 225 Gr,22.95,Clara De Huevo Liquida 1Kg 1 Kg,42.0,Tenders Tira De Pollo Preformados 907.18 Gr,103.0,Ensalada De Verduras 440 Gr,12.9
84,Golden Berries 170G/60Z,62.95,Palitos De Apio,29.95,Queso Manchego Con Nuez 700 Gr,174.0,Nuggets De Pollo Buffalo 680.4 Gr,143.0,Champiñones Rebanados En Lata 186 Gr,16.5
85,Platano Morado Gde 1 Kg,29.95,Zanahoria Baby Bolthouse 340 Gr,33.95,Queso Untable Chipotle Y Tomate 8 Oz,121.0,Nuggets De Pollo General Tso 680.39 Gr,143.0,Sopa De Camaron C/Chile Y Limon 64 Gr,11.9
86,Platano Deshidratado Natural 1 Kg,199.0,Pepino Criollo 1 Kg,21.95,Chilchota Queso Panela Canasta 800 G 800 Gr,117.0,Nuggets De Pollo Orange John Soules 680.39 Gr,143.0,Chiles Chipotles 215 Gr,20.5
87,Granada China Nal 1 Kg,119.0,Floretes De Coliflor 454 Gr,19.95,Leche Uht Almendra Sin Azucar 190Ml 190 Ml,13.0,Heb Tiras De Pollo Empanizado Cocidos 680.39 Gr,147.0,Sardinas De Tomate 425 Gr,36.9
88,Carambola 1 Kg,92.0,Champinon Jumbo De 500 Gr,49.95,Leche Uht Coconut Chocolate 190Ml 190 Ml,13.0,Heb Nuggets De Pollo Empanizado Cocido 680.3 Gr,147.0,Frijoles Reffritos Peruanos 430 Gr,12.5
89,Orejon De Chabacano 1 Kg,239.0,Mini Flakes De Coliflor,29.95,Almendra Vainilla Almendra Vainilla 946Ml 946 Ml,41.0,Heb Fajitas De Res Asadas Cocidoas 340 Gr,123.0,Pasta Coditos Con Queso 206 Gr,12.9
90,Mandarina Orlanado 1 Kg,19.95,Mezcla De Floretes Brocoli/Zanahoria,31.95,Coco Chocolate Coco Chocolate 250 Ml 250 Mm,20.0,Heb Fajitas De Pechuga Asadas Cocidos 737.08 Gr,168.0,Ensalada Atun Con Mayonesa 135 Gr,17.9
91,Platano Deshidratado Enchilado 1 Kg,239.0,Lechuga Hidroponica Trio Mix,27.95,Almendra Chocolate Almendra Chocolate 250 Ml,20.0,Carne Molida De Pollo 1 Kg,203.0,Frijoles Bayos Refritos Bajos En Grasa 430 Gr,10.9
92,Grajea 1 Kg,41.0,Lechuga Orejona Roja Pza,12.95,Las Espuelas Hojuelas Natural 20G 20 Gr,36.0,Pierna Bate Con Piel 1 Kg,148.0,Ensalada Campesina 220 Gr,7.9
93,Uva Pasa Golden 1 Kg,289.0,Camote Morado 1 Kg,40.95,Las Espuelas Hojuelas Natural 150G 150 Gr,255.0,Pechuga Entera 1 Kg,282.0,Atun En Aceite De Oliva Pouch 74 Gr,26.9
94,Orejon De Piña 1 Kg,259.0,Lechuga Hidroponica Mini Romaine,50.95,Las Espuelas Hojuelas Chile Limon 20G 20 Gr,36.0,Pechuga Sin Hueso 1 Kg,367.0,Atun Aceite 295 Gr,39.9
95,Pera Comice Imp 1 Kg,77.9,Hongo Cremini Baby 250 Gr,21.95,Las Espuelas Hojuelas Chile Limon 150G 150 Gr,253.0,Pollo Entero Orgánico 1 Kg,138.0,Atun En Agua Lata 130 Gr,21.9
96,Orejon De Mango 1 Kg,229.0,Chile Ancho 100Gr 100 Gr,24.95,Marsella Media Crema Marsella Media Crema 250 Ml,10.0,Milanesa Orgánica 1 Kg,390.0,Frijoles Refritos Bayos 430 Gr,13.0
97,Toronja Marss White 1 Kg,22.95,Ajo Pelado En Blister,24.95,Huevo Mediano Mt 30 Pz,61.0,Heb Brisket Ahumado Sabor Mezquite 340 Gr,287.0,Sopa Camaron Habanero Y Limon 64 Gr,9.5
98,Platano Pera 1 Kg,29.95,Heb Chile Cascabel 100G 100 Gr,24.95,Coita Queso Tipo Oaxaca 500 Gr,113.0,Heb Pulled Pork Sabor Bbq 454 Gr,103.0,Sopa Knorr Sopa Coditos Mas Pasta 24X115G 115 Gr,16.0
99,Orejon De Manzana 1 Kg,229.0,Heb Ajo En Malla 4 Pz,39.95,Mantequilla Clarificada 250 Gr,102.0,Heb Pollo Desmenuzado 340 Gr,93.0,Elote En Lata 410 Gr,12.9
100,Kumquat Njita Japonesa 1 Kg,19.5,Salsa Guacamole Ch,14.95,Mantequilla Barra Con Sal 100 G 100 Gr,35.5,Heb Brisket Desmenuzado Sabor Bbq 454 Gr,184.0,Champiñones Rebanados En Lata 380 Gr,32.0
